number,value,params_class_weight,params_max_depth,params_max_features,params_min_samples_leaf,params_min_samples_split,params_n_estimators,state
0,0.5746973311210538,,,,7,18,200,COMPLETE
1,0.6311628527217954,balanced,20.0,log2,4,7,100,COMPLETE
2,0.6307209498092561,balanced,15.0,,7,3,400,COMPLETE
3,0.6337379596137979,balanced_subsample,20.0,log2,9,19,400,COMPLETE
4,0.623299396607754,balanced,5.0,sqrt,1,17,200,COMPLETE
5,0.6218745005600705,balanced,20.0,,1,8,400,COMPLETE
6,0.6116094278057697,balanced_subsample,15.0,,1,10,100,COMPLETE
7,0.6224229857135575,balanced,5.0,log2,9,19,200,COMPLETE
8,0.627088127733674,balanced_subsample,,sqrt,1,18,500,COMPLETE
9,0.5756441192453587,,15.0,,4,11,200,COMPLETE
10,0.6290224041126308,balanced_subsample,20.0,log2,4,17,500,COMPLETE
11,0.6307854660506734,balanced,20.0,log2,7,2,300,COMPLETE
12,0.5672562590422666,,20.0,log2,10,11,500,COMPLETE
13,0.6329635854019156,balanced_subsample,20.0,log2,6,15,200,COMPLETE
14,0.6327021544983275,balanced_subsample,20.0,log2,7,20,300,COMPLETE
15,0.6329635854019156,balanced_subsample,20.0,log2,6,15,200,COMPLETE
16,0.631496744296481,balanced_subsample,30.0,,9,17,400,COMPLETE
17,0.6227624749845533,balanced,5.0,log2,8,18,400,COMPLETE
18,0.631135927425288,balanced,20.0,log2,9,12,300,COMPLETE
19,0.6329078878821187,balanced_subsample,20.0,sqrt,10,17,500,COMPLETE
20,0.571497803122237,,15.0,log2,8,15,300,COMPLETE
21,0.6318224447976798,balanced_subsample,20.0,log2,7,14,300,COMPLETE
22,0.6335653308078937,balanced_subsample,20.0,log2,10,16,200,COMPLETE
23,0.6313698964334115,balanced_subsample,,,10,15,100,COMPLETE
24,0.6324496755443162,balanced_subsample,20.0,log2,10,15,400,COMPLETE
25,0.5749701618182278,,20.0,sqrt,9,18,100,COMPLETE
26,0.6329147487585607,balanced_subsample,10.0,log2,10,10,100,COMPLETE
27,0.634238862279926,balanced_subsample,,log2,10,18,100,COMPLETE
28,0.6318460959028467,balanced_subsample,20.0,sqrt,10,17,300,COMPLETE
29,0.6317830680758956,balanced_subsample,,log2,8,17,100,COMPLETE
